RecipeId,Name,AuthorId,AuthorName,CookTime,PrepTime,TotalTime,DatePublished,Description,Images,RecipeCategory,Keywords,RecipeIngredientQuantities,RecipeIngredientParts,AggregatedRating,ReviewCount,Calories,FatContent,SaturatedFatContent,CholesterolContent,SodiumContent,CarbohydrateContent,FiberContent,SugarContent,ProteinContent,RecipeServings,RecipeYield,RecipeInstructions
202855,Aubergine (Eggplant) Curry (2),409106,Brian Holley,PT20M,PT10M,PT30M,2007-01-01T17:13:00Z,"Here is an English curry recipe, instead of using lots of spices the heat is given by the use of mustard powder.

This makes a wonderful accompaniment to any curry.","""https://img.sndimg.com/food/image/upload/w_555,h_416,c_fit,fl_progressive,q_95/v1/img/recipes/20/28/55/picHMbOXn.jpg""",Peppers,"c(""Vegetable"", ""Asian"", ""Indian"", ""Low Protein"", ""< 30 Mins"")","c(""1"", ""1"", ""12"", ""1"", ""2"", ""1/2"", ""1"", ""4"", ""1"", ""1"", ""1/2"", ""1/4"", ""1/4"", ""5"")","c(""green pepper"", ""aubergine"", ""tomatoes"", ""onion"", ""garlic cloves"", ""ground ginger"", ""lemon juice"", ""turmeric"", ""mustard powder"", ""cayenne pepper"", ""salt"", ""milk"")",NA,NA,320.9,25.1,18.8,5.3,183.7,24.4,6.2,7.4,5.5,4,NA,"c(""Heat the oil in a pan and fry the aubergine strips till light brown in colour and remove from the pan."", ""Add the onion, garlic, ginger and green pepper to the pan and fry for 3 minutes stirring all the time."", ""Now add the coconut cream, lemon juice, turmeric and mustard powder; stir."", ""Add the cooked aubergines, tomatoes, salt, cayenne pepper and the milk, bring to the  boil, reduce heat and cook for 10 minutes."")"
202856,Cauliflower With Toasted Mustard Seeds,409184,jonesies,PT15M,PT15M,PT30M,2007-01-01T17:13:00Z,"Tender cauliflowerets, cloaked in a mint-and-mustard flavored yogurt sauce and presented on a bed of lettuce. Served cold. Taken from the Sunset &quot;More Low Fat Recipes&quot; cookbook.",character(0),Cauliflower,"c(""Vegetable"", ""< 30 Mins"")","c(""3"", ""1"", ""1 1/2"", ""2"", ""2"", ""1"", ""1"")","c(""mustard seeds"", ""head cauliflower"", ""plain nonfat yogurt"", ""dried mint"", ""sugar"", ""ground cumin"", ""red leaf lettuce"")",NA,NA,168.1,3.1,0.3,1.8,157.1,25.6,7.5,15.2,12.8,4,NA,"c(""Toast mustard seeds in a small frying pan over medium heat until seeds turn gray (about 5 minutes), shaking pan often. Set aside."", ""Cut cauliflower into bite-size flowerets, then place on a rack over 1 inch of boiling water in a 5 to 6 quart pan; cover and steam until tender when pierced (about 8 minutes). Immerse cauliflower in ice water until cool, then drain well on paper towels."", ""In a large bowl, mix yogurt, mint, sugar, cumin and 2 tbsp of the mustard seeds.Add cauliflower and mix gently to coat well."", 
""To serve, arrange lettuce leaves on a platter. Spoon cauliflower mixture onto lettuce; sprinkle with remaining 1 tsp mustard seeds."")"
202857,Diabetic Friendly Country Apricot Tart,169430,Annacia,PT40M,PT30M,PT1H10M,2007-01-01T17:14:00Z,This fresh apricot filled tart takes on a rustic appearance with a folded-over cornmeal crust. Fresh peaches may also be used.,"""https://img.sndimg.com/food/image/upload/w_555,h_416,c_fit,fl_progressive,q_95/v1/img/recipes/20/28/57/pic6sARld.jpg""",Tarts,"c(""Dessert"", ""Fruit"", ""Summer"", ""< 4 Hours"")","c(""3/4"", ""1/3"", ""2"", ""1"", ""1/8"", ""3"", ""4 -5"", ""1/3"", ""3"", ""1/4"", ""3"", ""1"", ""2"")","c(""flour"", ""cornmeal"", ""Splenda sugar substitute"", ""baking powder"", ""salt"", ""butter"", ""margarine"", ""nonfat milk"", ""Splenda sugar substitute"", ""all-purpose flour"", ""ground nutmeg"", ""ground cinnamon"", ""fresh apricots"", ""lemon juice"", ""nonfat milk"")",5,1,143.4,4.9,2.8,11.6,119.7,22.6,2,6.3,3.1,8,NA,"c(""Grease and lightly flour a large baking sheet; set aside."", ""For the cornmeal crust, in a medium bowl stir together 3/4 cup flour, cornmeal, 2 tablespoons Splenda, baking powder, and salt."", ""Cut in butter or margarine until the size of small peas."", ""Sprinkle 1 tablespoon of cold fat-free milk over mixture; gently toss with a fork."", ""Add 3 to 4 tablespoons more fat-free milk, 1 tablespoon at a time, until the dough is moistened (dough will be crumbly)."", ""Turn out onto a lightly floured surface and knead 7 to 8 times or just until dough clings together and form into a ball.  On the baking sheet, flatten dough."", 
""Roll into a 12-inch circle and set aside."", ""For Filling:"", ""In a bowl stir together 1/3 cup Splenda, the 3 tablespoons flour, and the nutmeg or cinnamon. Stir in the apricots or peaches and lemon juice."", ""Mound the filling in center of crust, leaving a 2-inch border."", ""Fold border up over filling."", ""Brush top and sides of crust with the 2 teaspoons milk."", ""Bake in a 350 F degree oven about 40 minutes or until crust is golden and filling is bubbly."", ""To prevent overbrowning, cover the edge of the crust with foil the last 10 to 15 minutes of baking if needed."", 
""Cool tart for 30 minutes on the baking sheet on a wire rack."")"
202858,Easy French Toast,368300,1 Baker,PT22M,PT10M,PT32M,2007-01-01T17:14:00Z,Make and share this Easy French Toast recipe from Food.com.,character(0),Breakfast,"c(""< 60 Mins"", ""Easy"")","c(""4"", ""1/3"", ""2/3"", ""1/3"", ""1/2"", ""1/4"", ""6"", ""3"", NA, NA, NA)","c(""eggs"", ""flour"", ""milk"", ""sugar"", ""vanilla"", ""cinnamon"", ""butter"", ""powdered sugar"", ""butter"")",5,1,506.5,21.9,11,320.1,542.6,61.4,1.7,25,15.6,NA,NA,"c(""Mix together eggs, milk, flour, sugar, vanilla & cinnamon."", ""Lightly grease or spray with cooking spray a large skillet, or griddle; heat."", ""Drop each slice of bread into the batter. put in skillet."", ""Cook each slice 1 minute or until golden brown."", ""When done serve with butter, syrup and powdered sugar."")"
202859,Skillet Herbed Cabbage,262357,TXOLDHAM,PT10M,PT10M,PT20M,2007-01-01T17:15:00Z,This has been a favorite since the 1960's.  I have no memory of where I originally found this recipe but it is quite good and very easy to prepare.,"c(""https://img.sndimg.com/food/image/upload/w_555,h_416,c_fit,fl_progressive,q_95/v1/img/recipes/20/28/59/picsd5Ux4.jpg"", ""https://img.sndimg.com/food/image/upload/w_555,h_416,c_fit,fl_progressive,q_95/v1/img/recipes/20/28/59/picDu0v5a.jpg"")",Vegetable,"c(""< 30 Mins"", ""Easy"")","c(""2"", ""1"", ""1/2"", ""1/2"", ""1/8"", ""6"", ""1/3"")","c(""olive oil"", ""garlic clove"", ""oregano"", ""salt"", ""pepper"", ""cabbage"", ""water"")",5,3,86.1,6.9,0.9,0,310.2,6.1,2.5,3.8,1.6,4,NA,"c(""Heat oil and saute garlic along with the oregano."", ""Stir in cabbage and water mixing well."", ""Add salt and pepper to taste."", ""Cover and cook over medium heat, stirring occasionally 8 to 10 minutes or until tender."", ""Serve immediately."")"
202860,Calcutta Style Beef Curry,409106,Brian Holley,PT50M,PT10M,PT1H,2007-01-01T17:15:00Z,"Calcutta is a city with a reputation, the food is wonderful though.
This dish can be made with the cheapest cut of beef you can find.
The gravy is on the thin side and will enhance the rice when served.
The meat can be precooked, but keep the water.","c(""https://img.sndimg.com/food/image/upload/w_555,h_416,c_fit,fl_progressive,q_95/v1/img/recipes/20/28/60/picS34pY0.jpg"", ""https://img.sndimg.com/food/image/upload/w_555,h_416,c_fit,fl_progressive,q_95/v1/img/recipes/20/28/60/pic6RJyWu.jpg"")",Curries,"c(""Meat"", ""Asian"", ""Indian"", ""Very Low Carbs"", ""< 60 Mins"")","c(""1 1/2"", ""1"", ""1/2"", ""1/2"", ""2"", ""1/2"", ""1"", ""1/2"", ""2"", ""1"", ""2"", ""1"", ""1"", ""2"", ""2"")","c(""beef"", ""water"", ""salt"", ""turmeric"", ""ground coriander"", ""ground cumin"", ""chili powder"", ""ground black pepper"", ""salt"", ""ground ginger"", ""milk"", ""onion"", ""garlic clove"", ""ghee"", ""fresh coriander"")",5,1,1229.4,127.7,54.3,186,1518.7,4.8,1.3,1.3,14.9,4,NA,"c(""Boil the water with the 1/2 tsp salt, add the beef and simmer til it is tender."", ""Mix the spices together and add the milk to make a paste."", ""Melt the ghee and fry the onions and garlic til golden. Add the spice paste and fry for 3 minutes."", ""Add the meat and half of the water it was cooked inches Bring to the boil and simmer for 15 minutes."", ""IF THE GRAVY IS TOO THICK ADD SOME MORE OF THE WATER."", ""Garnish with the chopped coriander."", ""Serve with boiled rice."")"
202861,Pina Colada Sherbet,169430,Annacia,PT8H,PT20M,PT8H20M,2007-01-01T17:16:00Z,"Tropical flavors of coconut, pineapple, orange, and island rum combine for a four-ingredient wonder of sublime taste. Transform a favorite summer cocktail into a cool and refreshing dessert. The 8 hrs of &quot;cooking&quot; time is freezing time.","""https://img.sndimg.com/food/image/upload/w_555,h_416,c_fit,fl_progressive,q_95/v1/img/recipes/20/28/61/picZDIXO9.jpg""",Frozen Desserts,"c(""Dessert"", ""Fruit"", ""Low Protein"", ""Summer"", ""Sweet"", ""Beginner Cook"", ""Easy"")","c(""1"", ""1"", ""1"", ""1/4"")","c(""cream of coconut"", ""crushed pineapple"", ""light rum"")",5,4,335.8,19.7,17.3,0,56.8,32.6,3.4,27.6,3.8,NA,4 cups,"c(""In a blender container or food processor bowl combine cream of coconut, undrained pineapple, orange juice, and rum. (If using a food processor, process only half of all the ingredients at a time.)"", ""Cover; blend or process until nearly smooth."", ""Pour into a 9x5x3-inch loaf dish or a 2-quart baking dish."", ""Cover; freeze about 4 hours or until firm."", ""Break sherbet into pieces."", ""Place sherbet, about half at a time, in a blender container or food processor bowl."", ""Cover; blend or process until fluffy. (Or, place in a chilled bowl and beat with an electric mixer until fluffy.)"", 
""Return pineapple mixture to pan."", ""Cover and freeze at least 4 hours or until firm."")"
202862,Low Fat Buffalo Chicken Tenders W/ Blue Cheese Dip,409184,jonesies,PT15M,PT35M,PT50M,2007-01-01T17:17:00Z,"Using the lean chicken tender reduced the amuont of fat, as does baking the chicken instead of frying. The blue cheese dip is lower in fat and calories, so this is guilt free snacking! Taken from the Heart Healthy cookbook. Note: prep time includes marinate/refrigeration time.
Note: After making these many times, I have found that it is much easier to cook them on the George Foreman after marinading. I'm sure pan frying would work as well. Experiment and enjoy!",character(0),Chicken Breast,"c(""Chicken"", ""Poultry"", ""Meat"", ""Healthy"", ""< 60 Mins"", ""Beginner Cook"", ""Easy"")","c(""3"", ""1/2"", ""1/4"", ""1"", ""1/2"", ""1/4"", ""2"", ""2"", ""2"")","c(""paprika"", ""reduced-fat sour cream"", ""blue cheese"", ""celery ribs"", ""carrots"")",4.5,4,107.9,2.5,1.2,37.9,360.1,6.6,1.2,2.8,14.4,8,NA,"c(""Preheat oven to 375°F."", ""Combine the hot sauce, paprika and ground pepper in a small bowl; brush on all surfaces of chicken."", ""Place chicken in greased 11 x 7 inch baking pan."", ""Cover; marinate in refrigerator for 30 minutes."", ""Bake, uncovered, about 15 minutes or until chicken is no longer pink in the center."", ""Combine blue cheese dressing, sour cream and blue cheese in small serving bowl."", ""Serve chicken with dip and celery/carrot sticks."")"
202863,Heartwarming Beef-Barley Soup,169430,Annacia,PT1H15M,PT25M,PT1H40M,2007-01-01T17:17:00Z,Make and share this Heartwarming Beef-Barley Soup recipe from Food.com.,"c(""https://img.sndimg.com/food/image/upload/w_555,h_416,c_fit,fl_progressive,q_95/v1/img/recipes/20/28/63/picV1RumN.jpg"", ""https://img.sndimg.com/food/image/upload/w_555,h_416,c_fit,fl_progressive,q_95/v1/img/recipes/20/28/63/pictmWd3f.jpg"", ""https://img.sndimg.com/food/image/upload/w_555,h_416,c_fit,fl_progressive,q_95/v1/img/recipes/20/28/63/piclyo6Pb.jpg"", ""https://img.sndimg.com/food/image/upload/w_555,h_416,c_fit,fl_progressive,q_95/v1/img/recipes/20/28/63/picui486c.jpg"", ""https://img.sndimg.com/food/image/upload/w_555,h_416,c_fit,fl_progressive,q_95/v1/img/recipes/20/28/63/pictawjwR.jpg"", 
""https://img.sndimg.com/food/image/upload/w_555,h_416,c_fit,fl_progressive,q_95/v1/img/recipes/20/28/63/picETCT2s.jpg"")",Vegetable,"c(""Meat"", ""Low Cholesterol"", ""Healthy"", ""< 4 Hours"")","c(""1 1/2"", ""4"", ""2"", ""2"", ""2"", ""1"", ""1"", ""1"", ""1"", ""1/2"", ""1"", ""1"", ""1"")","c(""boneless beef chuck"", ""water"", ""low sodium beef broth"", ""celery"", ""fresh mushrooms"", ""carrot"", ""onion"", ""salt"", ""dried rosemary"", ""pepper"", ""garlic clove"", ""tomato paste"", ""quick-cooking barley"")",5,18,241.9,6,2.5,56.1,568.2,26.2,6.3,5.2,22.9,8,NA,"c(""Trim fat from meat, cut meat into 1/2-inch cubes."", ""In a Dutch oven combine meat, water, broth, celery, mushrooms, carrots, onion, salt, rosemary, pepper, and garlic and bring to boiling, reduce heat."", ""Cover and simmer 1 to 1-1/4 hours or until meat is tender, if necessary, skim fat."", ""Stir in tomato paste and barley. Return to boiling; reduce heat. Cover and simmer about 10 minutes or until barley is done."")"
202864,Lower Fat Reuben Bites,409184,jonesies,PT10M,PT10M,PT20M,2007-01-01T17:18:00Z,"I love the taste of Reuben Sandwiches, but am trying to lose weight. Came across this recipe in the &quot;Heart Healthy&quot; cookbook, and will be trying this version soon.","""https://img.sndimg.com/food/image/upload/w_555,h_416,c_fit,fl_progressive,q_95/v1/img/recipes/20/28/64/piczLnmpS.jpg""",Lunch/Snacks,"c(""< 30 Mins"", ""Beginner Cook"", ""Easy"")","c(""24"", ""1/2"", ""6"", ""1"", ""1"")","c(""lowfat swiss cheese"", ""alfalfa sprout"")",NA,NA,52.1,1.4,0.6,14.1,246.7,4.1,0.4,2.4,5.6,12,NA,"c(""Preheat oven to 400°F."", ""Arrange bread slices on a nonstick baking sheet. Bake 5 minutes or until lightly toasted."", ""Spread 1 teaspoon dressing onto each bread slice; top with pastrami, folding slices to fit bread slices. Sprinkle, evenly with cheese."", ""Bake 5 minutes or until hot. Top evenly with sprouts. Transfer to serving plate. Serve immediately."")"
202865,Baked French Toast Casserole,413880,Chef likestocook,PT12M,PT30M,PT42M,2007-01-01T17:18:00Z,"This is very good and the topping is out of this world.  You won't even need syrup.  Since it is made the night before, it is a great recipe for guests.","c(""https://img.sndimg.com/food/image/upload/w_555,h_416,c_fit,fl_progressive,q_95/v1/img/recipes/20/28/65/22SccoVaRdyN7u2dqYcV_Easy%20Breakfast%20Recipe%20French%20Toast%20Casserole_1480.jpg"", ""https://img.sndimg.com/food/image/upload/w_555,h_416,c_fit,fl_progressive,q_95/v1/img/recipes/20/28/65/picNIKIjT.jpg"")",Breakfast,"c(""Brunch"", ""< 60 Mins"", ""Oven"")","c(""1"", ""8"", ""2"", ""1"", ""2"", ""1"", ""1/4"", ""1/4"", ""1"", ""1"", ""1"")","c(""eggs"", ""half-and-half"", ""milk"", ""sugar"", ""vanilla"", ""cinnamon"", ""nutmeg"", ""butter"", ""brown sugar"", ""pecans"")",5,13,594.1,38.1,17.9,239.3,503.4,52.6,2.5,24.7,12.5,10,NA,"c(""Place sliced bread in 2 large baking pans that have been sprayed with PAM."", ""Mix eggs, half and half, milk, sugar, vanilla, and spices."", ""Pour over bread."", ""Refrigerate overnight."", ""The next morning combine the last 3 ingredients and put on top."", ""Sprinkle with cinnamon and nutmeg and bake at 350 for 30 minutes or until done."")"
202867,Bleu Cheese Bread,277462,Feisty,PT10M,PT5M,PT15M,2007-01-01T17:18:00Z,"This is a nice flavorful spread for italian bread.  Even people that don't ordinarily like bleu cheese will like these, since the cheese takes on a different kind of flavor once broiled.","c(""https://img.sndimg.com/food/image/upload/w_555,h_416,c_fit,fl_progressive,q_95/v1/img/recipes/20/28/67/picWkVKbg.jpg"", ""https://img.sndimg.com/food/image/upload/w_555,h_416,c_fit,fl_progressive,q_95/v1/img/recipes/20/28/67/picYxOksy.jpg"")",Spreads,"c(""Breads"", ""< 15 Mins"", ""Beginner Cook"", ""Easy"")","c(""1"", ""1"", ""1/2"", ""1"")","c(""margarine"", ""blue cheese"", ""mayonnaise"")",5,3,256,17.9,5.2,13.2,553.6,18.2,0.8,1.1,5.7,NA,10 slices,"c(""Blend margarine, bleu cheese and mayonnaise in a mixer or by hand until creamy and thoroughly incorporated."", ""Heat oven to 450 degrees."", ""Slice bread into 3/4\"" slices and spread each slice with cheese mixture."", ""Place on greased baking sheet and bake about 5-10 minutes or until top is bubbly and lightly browned."")"
202868,Roasted Garlic &amp; Spinach Spirals,409184,jonesies,PT45M,PT15M,PT1H,2007-01-01T17:19:00Z,"Lighter spirals full of flavor. Taken from the Heart Healthy cookbook. Makes a great low-cal appetizer or party dish. Tip: for best result, cover tortilla rolls and refrigerate 1 to 2 hours before serving.",character(0),Spinach,"c(""Greens"", ""Vegetable"", ""Low Cholesterol"", ""Healthy"", ""< 60 Mins"", ""Easy"", ""Inexpensive"")","c(""1"", ""3"", ""1"", ""1"", ""1/4"", ""1/8"", ""7"")","c(""fresh garlic"", ""fresh spinach leaves"", ""white beans"", ""dried oregano"", ""black pepper"", ""flour tortillas"")",4,1,168.3,2.9,0.7,0,228.4,29.4,3.5,0.8,6.6,10,NA,"c(""Preheat oven to 400 degrees."", ""Trim top of garlic just enough to cut tips off center cloves; discard tips."", ""Moisten head of garlic with water; wrap in foil."", ""Bake 45 minutes or until garlic is soft and has a mellow garlicky aroma; cool."", ""Remove garlic from skin by squeezing between fingers and thumb; place in food processor."", ""Rinse spinach leaves; pat dry with paper towels."", ""Remove stems; discard."", ""finely shred leaves by stacking and cutting several leaves at a time."", ""Place in medium bowl."", 
""Add bean, oregano, black pepper and red pepper to food processor; process until smooth."", ""Add spinach; mix well."", ""Spread mixture evenly onto tortillas; roll up."", ""Trim 1/2 inch off ends of rolls; discard."", ""cut rolls into 1-inch pieces."", ""Transfer to serving plate; garnish with fresh veggies if desired."")"
202869,Tex-Mex Tostadas (Lower Fat),409184,jonesies,PT10M,PT20M,PT30M,2007-01-01T17:19:00Z,Make and share this Tex-Mex Tostadas (Lower Fat) recipe from Food.com.,"c(""https://img.sndimg.com/food/image/upload/w_555,h_416,c_fit,fl_progressive,q_95/v1/img/recipes/20/28/69/picjUrDi1.jpg"", ""https://img.sndimg.com/food/image/upload/w_555,h_416,c_fit,fl_progressive,q_95/v1/img/recipes/20/28/69/picKx3AZK.jpg"")",Lunch/Snacks,"c(""Chicken Breast"", ""Chicken"", ""Poultry"", ""Meat"", ""Mexican"", ""< 30 Mins"")","c(""4"", NA, ""1"", ""3/4"", ""1 1/2"", ""1"", ""1"", ""1/2"", ""1/3"", ""1"", ""1"", ""1/4"")","c(""fat free tortillas"", ""green bell pepper"", ""boneless skinless chicken breast"", ""garlic"", ""chili powder"", ""ground cumin"", ""chunky salsa"", ""green onion"", ""tomatoes"", ""nonfat sour cream"")",5,2,136.7,1.7,0.5,50.8,272.5,8.6,1.9,3.9,21.8,4,NA,"c(""Preheat oven to 450 degrees. Place tortillas on baking sheet; coat both sides with cooking spray. bake 5 minutes or until lightly browned and crisp. Remove; set aside."", ""Coat large nonstick skillet with cooking spray. Add bell pepper, cook and stir 4 minutes. Add chicken, garlic, chili powder and cumin; cook and stir 4 minutes or until chicken is no longer pink in center. Add 1/4 cup salsa and green onions; cook and stir 1 minute. Remove skillet from heat; set aside."", ""Combine refried beans and remaining 1/4 cup salsa in a microwavable bowl. Cook uncovered at high 1 1/2 minutes or until beans are heated through."", 
""Spread bean mixture evenly over tortillas. Spoon chicken mixture and tomato over bean mixture. Garnish with sour cream and add shredded lettuce if you desire."")"
202871,Popping Pepper Packs,409184,jonesies,NA,PT20M,PT20M,2007-01-01T17:20:00Z,"Fun-filled meal, especially for kids. But I have to admit, I like the visual on my plate too! You can adapt the filling to suit your needs, by adding any longer, eye-appealing veggie you desire. If you took out the chicken, would be nice to present at a casual dinner party. Enjoy! Note: you can use any dressing on the bottom, sometimes blue cheese isn't very kid friendly, so maybe try some ranch or your favorite homemade dressing!","""https://img.sndimg.com/food/image/upload/w_555,h_416,c_fit,fl_progressive,q_95/v1/img/recipes/20/28/71/pickrff49.jpg""",Lunch/Snacks,"c(""Peppers"", ""Vegetable"", ""Kid Friendly"", ""< 30 Mins"", ""Easy"")","c(""4"", ""1"", ""1"", ""2"", ""1"", ""2"", ""2"", ""1/2"", ""1/4"", ""2"")","c(""red bell peppers"", ""green onion"", ""broccoli"", ""carrots"", ""fresh snow pea"", ""celery ribs"", ""reduced-fat sour cream"", ""blue cheese"")",4,2,177.6,3.6,1.6,8,385.5,33.3,9.8,14.3,8.3,4,NA,"c(""Slice tops off of pepper, remove seeds. Slice 2 tablespoons of green onion, set aside."", ""Prepare veggies as noted above."", ""Cut the tops of the remaining green onions half way down, then cut the green portion several times in order to \""spray\"" outwards."", ""Mix the salad dressing, sour cream, blue cheese and 2 tbsp green onion."", ""Place some of the dressing mix into the bottom of the red peppers."", ""Arrange veggies and chicken strips standing up inside of peppers."", ""Note: Have fun with the preparation, arrange to look like the ingredients are \""blooming\"" from the pepper! Nice and colorful!""
)"
202873,Almond Cookies,420515,Belloo,NA,PT1H,PT1H,2007-01-01T17:21:00Z,"One of the cookies I make for Christmas. This is a recipe that comes from Holland, birthplace of my parents.","""https://img.sndimg.com/food/image/upload/w_555,h_416,c_fit,fl_progressive,q_95/v1/img/recipes/20/28/73/pic1fsBGn.jpg""",Dessert,"c(""Cookie & Brownie"", ""Dutch"", ""European"", ""Christmas"", ""< 60 Mins"")","c(""1"", ""2"", ""2"", ""1"", ""3 1/2"", ""1"", ""1"", ""1"", ""1"", ""1/2"", ""1/4"", ""1/4"", ""1"", ""1"", ""1/4"")","c(""butter"", ""brown sugar"", ""eggs"", ""all-purpose flour"", ""salt"", ""baking soda"", ""baking powder"", ""sugar"", ""lemon juice"")",5,1,97.7,4.2,2.1,18.3,94.3,13.9,0.4,8,1.4,NA,60 cookies,"c(""COOKIE DOUGH:"", ""Cream butter with sugar until fluffy."", ""Beat in eggs, one at a time, and almond extract."", ""Stir together flour, salt, baking soda and powder; gradually stir into creamed mixture until well blended."", ""Cover and refrigerate for at least 1 hour or until firm."", ""FILLING:"", ""Meanwhile, mix together filling ingredients until smooth."", ""ASSEMBLY:"", ""Using hands, roll heaping teaspoonfuls of dough into 1-inch balls."", ""With finger, make indentation in centre of each; stuff with about 1/4 teaspoons filling. Pinch off dime-sized piece of dough; press over filling to cover."", 
""Reroll in palms to seal and smooth edges."", ""Place 2 inches apart on greased baking sheets. Brush tops with egg white; press almond lightly into each."", ""Bake in 325oF oven for 15 to 18 minutes or until light golden."", ""Let cool on racks. Makes about 5 dozen."")"
202874,Christmas Bread (Almond-Filled Challah),420515,Belloo,PT30M,PT4H,PT4H30M,2007-01-01T17:22:00Z,Make and share this Christmas Bread (Almond-Filled Challah) recipe from Food.com.,"c(""https://img.sndimg.com/food/image/upload/w_555,h_416,c_fit,fl_progressive,q_95/v1/img/recipes/20/28/74/C4HPoNpgTFe2nDZZL1um_IMG_0211.JPG"", ""https://img.sndimg.com/food/image/upload/w_555,h_416,c_fit,fl_progressive,q_95/v1/img/recipes/20/28/74/o5z1ecMoSZiD2gMRGmZe_IMG_0216.JPG"")",Yeast Breads,"c(""Breads"", ""European"", ""Christmas"")","c(""1"", ""1"", ""1"", ""4"", ""1/4"", ""2"", ""2"", ""1/2"", ""1"", ""1"", ""1 1/2"", ""1/2"", ""1"", ""3 -4"", ""1"")","c(""water"", ""sugar"", ""all-purpose flour"", ""granulated sugar"", ""salt"", ""eggs"", ""water"", ""sugar"", ""milk"")",NA,NA,4489.5,200.5,26,544.4,4904.2,575.7,34.1,162,106.8,NA,1 loaf,"c(""Pour lukewarm (110oF) water into a small bowl. Add 1 teaspoon sugar and stir until dissolved. Sprinkle yeast over top. Do not stir. Let stand for 10 minutes, until mixture is foamy."", ""Meanwhile, measure 3 cups flour into a large bowl. Using a fork, stir in 1/4 cup sugar and 2 tsp salt. Form a well in centre of mixture. Add eggs, oil and yeast mixture. Stir well, using a spoon, just until blended."", ""Turn dough onto lightly floured surface. Knead dough with floured hands. When dough becomes sticky, liberally sprinkle flour on kneading surface. Continue kneading until dough forms a smooth satiny ball, about 10 minutes. By this time, you will have incorporated most of flour, and dough should bounce back when pressed with your finger."", 
""Place dough in a large oiled bowl. Roll around inside of bowl until dough is completely covered with a light coating of oil. Cover bowl with a piece of oiled waxed paper, topped by a damp cloth. Let stand in a warm place, such as on top of the refrigerator, until doubled in size, about 45 minutes."", ""In the meantime, prepare filling. In a small bowl, blend ground almonds and sugar. Stir in egg white, milk and almond extract until thoroughly blended."", ""Set aside."", ""Punch down dough. Cover and let rise again until double in size, about 45 minutes."", 
""Divide dough into 3 equal parts. Roll into long strands. Flatten each strand with rolling pin. Spread almond filling over each strand to 1/4 inch from sides. Roll back into long strands."", ""Place strands on a lightly greased baking sheet. And braid loosely. Tuck in ends.* Cover with a damp cloth and let dough rise until doubled in size, about 45 more minutes."", ""Preheat oven to 400oF. Whisk egg yolk with water. Brush loaf with beaten egg yolk. Bake in centre of preheated oven until golden brown, about 30 minutes Place piece of foil paper over bread if browning too quickly."", 
""*You can also shape braid into a circle to form wreath and decorate with an icing sugar frosting, almonds and cherries."")"
