RecipeId,Name,AuthorId,AuthorName,CookTime,PrepTime,TotalTime,DatePublished,Description,Images,RecipeCategory,Keywords,RecipeIngredientQuantities,RecipeIngredientParts,AggregatedRating,ReviewCount,Calories,FatContent,SaturatedFatContent,CholesterolContent,SodiumContent,CarbohydrateContent,FiberContent,SugarContent,ProteinContent,RecipeServings,RecipeYield,RecipeInstructions
202510,Cornbread &amp; Sausage Wheel,42290,Aunt Willie,PT20M,PT20M,PT40M,2006-12-30T16:04:00Z,"When my Nana passed away a few years ago, I was lucky enough to receive her shoebox of recipes. They are a mix of ones cut from magazines and handwritten cards. I am posting some that I remember.",character(0),Breads,"c(""< 60 Mins"", ""Easy"")","c(""1"", ""1"", ""1/2"", ""4"", ""1"", ""1"", ""1"", ""2"", ""1/2"")","c(""pork sausage link"", ""flour"", ""salt"", ""baking powder"", ""yellow cornmeal"", ""egg"", ""milk"", ""onion"")",NA,NA,2538.9,140,47.9,572.5,5738.9,210.9,13.1,3.9,106.2,NA,1 wheel,"c(""Preheat overn to 425 degrees."", ""Brown sausage links in oven-proof skillet (cast iron works best) over low heat on top of stove."", ""Drain fat, reserving 2 tablespoons."", ""Arrange browned links in pan, so that they look like spokes of a wheel."", ""Sift together flour, salt, baking powder and corn meal in a medium bowl."", ""Make a well in the center and add egg, milk and the reserved 2 tablespoons of drippings."", ""Beat by hand until smooth, making sure not to over mix."", ""Fold in chopped onions."", 
""Pour mixture evenly over suasage links."", ""Bake at 425 degrees for 20 minutes or until tester comes out clean."", ""To serve, invert onto plate or platter."", ""Cut into wedges, keeping the sausage link in the center of the wedge."")"
202513,Zooma's Spiced Pumpkin Cheesecake,290201,LadyLaura,PT2H,PT1H,PT3H,2006-12-30T16:06:00Z,A cheesecake from a local restaurant called Zooma. This was published in the Providence Journal on Wednesday 12/27/06,character(0),Cheesecake,"c(""Dessert"", ""Cheese"", ""Thanksgiving"", ""< 4 Hours"")","c(""1 1/2"", ""1 1/2"", ""1 1/4"", ""1/4"", ""1/4"", ""4"", ""1 1/2"", ""3"", ""1"", ""1"", ""2"", ""1"", ""1"", ""1"", ""1/2"", ""1/2"", ""1"", ""5"", ""1"", ""6"", ""4"", ""1 1/2"", ""7"")","c(""graham crackers"", ""walnuts"", ""brown sugar"", ""unsalted butter"", ""cream cheese"", ""sugar"", ""eggs"", ""pumpkin puree"", ""heavy cream"", ""vanilla extract"", ""ground cinnamon"", ""ground allspice"", ""ground nutmeg"", ""ground ginger"", ""ground cloves"", ""sour cream"", ""heavy cream"", ""cinnamon"", ""sugar"", ""water"", ""butter"", ""heavy cream"")",NA,NA,830.6,62.9,32.5,217.1,371.7,61.4,1.6,51,10.4,NA,1 cheesecake,"c(""Crust."", ""Position rack in center of oven and preheat to 350 degrees."", ""Wrap outside of spring-form pan with heavy duty foil to prevent leaking."", ""Combine cookies, graham crackers, 1 cup of walnuts and brown sugar in food processor."", ""Reserve remaining walnuts for topping of cake."", ""Slowly add butter and pulse the processor until crumbs begin to stick together."", ""Press crumbs into the bottom, not sides of pan."", ""Filling."", ""Using an electric mixer, beat cream cheese and sugar until smooth and fluffy."", 
""Transfer 3/4 cup of the mixture to small bowl; cover tightly and refrigerate for topping."", ""Beat in eggs one at a time."", ""Add pumpkin and remaining seven ingredients."", ""Beat until just blended."", ""Pour filling into prepared crust."", ""Place spring-form pan in large roasting pan."", ""Add enough water to come halfway up sides of spring-form pan."", ""Bake until slightly puffed and softly set and top is golden, about 1 1/2 hours."", ""Transfer pan to rack and cool."", ""Refrigerate cake overnight, or if needed that day it can be placed in freezer for 6 hours."", 
""Topping."", ""Bring remaining 3/4 cup cream cheese mixture to room temperature."", ""Add sour cream, heavy cream and cinnamon to cream cheese misture and stir to combine."", ""Remove cheesecake from refrigerator."", ""Press down firmly on sides of cheesecake to even its thickness."", ""Using a knife, cut around sides of pan to loosen cake; release pan sides."", ""Spread topping mixture evenly over cheesecake."", ""Caramel Sauce."", ""Cook sugar and water until sugar browns, stirring constantly."", ""Remove from heat and blen in butter, then stir in cream immediately."", 
""Drizzle caramel sauce over cake and refrigerate until caramel sets, about 20 minutes."", ""Remove from refrigerator and dust the edges of cheesecake with the reserved 1/4 cup of  of toasted walnuts."", ""Slice and serve."")"
202514,Crock Pot Curried Split Pea Soup,130513,gobruijns,NA,PT25M,PT25M,2006-12-30T16:06:00Z,A spin off your regular split pea soup recipe and a great way to use up leftover ham!  I used my leftover ham bone from Christmas dinner. The kids loved it.  I got this recipe using Better Homes and Gardens' &quot;Slow Cooker Meals.&quot;,character(0),Ham,"c(""Pork"", ""Vegetable"", ""Meat"", ""Winter"", ""< 30 Mins"", ""Easy"")","c(""1"", ""1"", ""1 1/2"", ""1 1/2"", ""1"", ""1"", ""3 -4"", ""1"", ""2"", ""1/4"", ""6"")","c(""ham bone"", ""cooked ham"", ""celery"", ""onion"", ""carrot"", ""curry powder"", ""dried marjoram"", ""bay leaves"", ""ground black pepper"", ""water"")",5,2,376.5,7.1,2.4,31.7,70.8,51.7,21,8.5,28.4,6,NA,"c(""In a 5- to 6-quart slow cooker, combine split peas, pork hocks, ham, celery, onion, carrot, curry powder, marjoram, bay leaves, and pepper.  Stir in the water."", ""Cover and cook on low-heat setting for 9 to 11 hours or on high-heat setting for 4 1/2 to 5 1/2 hours."", ""Discard bay leaves."", ""Remove pork hocks."", ""When pork hocks are cool enough to handle, remove meat from bones; discard bones."", ""Coarsely chop meat."", ""Return meat to soup."")"
202515,Black and White Bean Chili,211579,Chef Grizzly,PT30M,PT10M,PT40M,2006-12-30T16:06:00Z,"When the snow flies, I like to make Chili, with and without meat.  This is a variation on black bean chili I came up with one night and liked.  Add some shredded chicken or cubed pork to it if you like.","""https://img.sndimg.com/food/image/upload/w_555,h_416,c_fit,fl_progressive,q_95/v1/img/recipes/20/25/15/picHu3z0y.jpg""",Black Beans,"c(""Corn"", ""Beans"", ""Vegetable"", ""Low Cholesterol"", ""Healthy"", ""Spicy"", ""< 60 Mins"", ""Stove Top"", ""Easy"")","c(""1"", ""1"", ""2"", ""1"", ""2"", ""1"", ""1"", ""3"", ""1"", ""1 -2"", NA, ""2"")","c(""red onion"", ""olive oil"", ""white beans"", ""black beans"", ""corn kernels"", ""chopped tomatoes"", ""chicken broth"", ""cumin"", ""salt"", ""celery"")",4,1,419.2,7,1.2,0,735.3,75.2,15.9,10.1,20,NA,2 qt,"c(""In a large pot, heat oil and sauté onions."", ""Add rest through chili relish (separate recipe as Chile Relish). Bring to a boil."", ""Reduce heat & simmer 15-20 minute (If you decide to add cooked chicken or pork, add it now & let simmer 30-40 min)"", ""Add Cumin and Salt to taste, add celery & simmer another 5 minute."")"
202516,Feta Cheese Ball,28636,Acerast,PT2H,PT10M,PT2H10M,2006-12-30T16:07:00Z,"We love this combination of pungent flavors.  The original version was submitted by Kelly O'Rourke on allrecipes.com however I lightened it a bit by using reduced fat cream cheese, less oil and then added our preferred amounts of seasonings.  Allow at least 2 hours for chilling time.",character(0),Spreads,"c(""European"", ""< 4 Hours"")","c(""2"", ""4"", ""2"", ""3"", ""4"", ""1"", ""2"", ""1"")","c(""feta cheese"", ""extra virgin olive oil"", ""garlic cloves"", ""green onions"", ""dried dill weed"", ""dried oregano"", ""cracked black pepper"")",5,1,1191.5,106.3,59.3,301.1,2113.8,20,2.4,4.3,43.3,NA,1 1/2 cups,"c(""With an electric mixer or food processor, combine the cream cheese, feta cheese, olive oil, green onions and garlic."", ""Season with dill, oregano and cracked black pepper; mix well."", ""Form into 2 balls or place in a decorative bowl."", ""Cover with plastic wrap and chill for at least 2 hours to allow it to become firm and for flavors to blend."", ""Enjoy on vegetable sticks, assorted crackers, bread sticks, or toasted pita triangles or baguette rounds."")"
202519,Baked Onions With Thyme,408454,Chef Shadows,PT50M,PT5M,PT55M,2006-12-30T16:08:00Z,This is a recipe that I have been able to trace back to the 18th century. It is simple but good as a side dish for beef or pork.,character(0),Onions,"c(""Vegetable"", ""Egg Free"", ""Free Of..."", ""Savory"", ""< 60 Mins"", ""Beginner Cook"", ""Easy"")","c(""6"", ""3"", ""10"", NA, ""1/2"", ""1/4"")","c(""red onions"", ""extra virgin olive oil"", ""fresh thyme sprigs"", ""dried thyme"", ""fine sea salt"", ""dry red wine"", ""water"")",4,1,122.5,6.8,1,0,4.4,11.6,1.5,4.8,1,6,NA,"c(""Oil and Preheat dutch oven to 400°F (hot)."", ""Cut a slice from both ends of each onion, then halve onions crosswise."", ""Discard outer layers from onions, leaving about a 2 1/2-inch diameter."", ""Arrange onions, trimmed ends down in dutch oven."", ""Drizzle with oil."", ""Remove leaves from 2 thyme sprigs and sprinkle over onions."", ""Season with sea salt and pepper, then scatter remaining 8 sprigs over onions."", ""Pour wine over onions."", ""Bake, with majority of coals on lid, basting with pan juices twice during baking, 40 minutes."", 
""Add water to oven and bake until onions are browned and tender, about 50 minutes more."", ""Serve hot or at room temperature."", ""Makes 6 (first course) servings."")"
202520,Hot Italian Cheesy Dip,418091,seattlepalm,PT1H,PT20M,PT1H20M,2006-12-30T16:08:00Z,"Cheese dip with kick! This is a great spicy dip good for gatherings and parties where appetizers are a must. For added heat use picante salsa. If you do not have homemade salsa, I suggest the Pace brand. The hot sauce and pepper flakes are optional depending on how much spice you and your guests can handle.",character(0),Pork,"c(""Cheese"", ""Meat"", ""Spicy"", ""< 4 Hours"", ""Easy"")","c(""1"", ""1"", ""16"", NA, NA)","c(""hot Italian sausage"", ""Velveeta cheese"", ""salsa"")",NA,NA,381.7,27.9,13.5,77.2,1897.4,11.8,1.1,6.9,20.9,NA,NA,"c(""Brown the hot Italian sausage. Drain the fat. Put browned sausage in a crock pot on low setting."", ""Dice the velveeta cheese. Add to the crock pot."", ""Pour in the salsa and stir well."", ""Let mixture cook on low setting until cheese is thoroughly melted. Stir occasionally."", ""Stir in hot sauce and pepper flakes to taste (optional)."", ""Keep crock pot on low setting to serve. Stir occasionally to keep dip from burning to the crock pot. Serve with tortilla chips."")"
202521,Stuffed Bell Pepper Soup,203823,MommyMakes,PT30M,PT20M,PT50M,2006-12-30T16:09:00Z,"They serve this in the cafeteria at work and it is the most requested.  It is a very hearty and yet low-calorie meal. This recipe makes 8 cups so is great for OAMC, make ahead of time and serve over fresh rice.
1 cup of soup is about 150 calories and 1 cup of rice is approx 200 depending on the type.  We usually use a wild rice blend.","""https://img.sndimg.com/food/image/upload/w_555,h_416,c_fit,fl_progressive,q_95/v1/img/recipes/20/25/21/pic52mUVR.jpg""",One Dish Meal,"c(""Rice"", ""Peppers"", ""Vegetable"", ""Meat"", ""Very Low Carbs"", ""Low Cholesterol"", ""Kid Friendly"", ""Winter"", ""Camping"", ""< 60 Mins"", ""Beginner Cook"", ""Easy"", ""Inexpensive"")","c(""1"", ""1/2"", ""2"", ""1"", ""2"", ""1"", ""2"", ""1 -2"", NA, NA)","c(""ground beef"", ""onion"", ""celery"", ""green pepper"", ""garlic cloves"", ""diced tomatoes"", ""crushed tomatoes"", ""water"", ""low sodium beef broth"", ""rice"")",5,14,149,8.7,3.4,38.6,56.4,6,1.9,3.3,11.7,8,8 cups,"c(""Brown ground beef until fully cooked."", ""Drain fat from beef and set aside, do not discard the fat."", ""Saute the vegetables in the same pan."", ""Add water or broth, beef base, ground beef and rendered fat, let simmer for at least 15 minutes. Salt and pepper to taste."", ""The longer this soup simmers the better the flavor. Stir in desired amount of rice."", ""For OAMC cooking divide soup into 2 cup containers and freeze without adding the rice.  When ready to serve thaw and heat soup and serve with fresh rice. (You can probably freeze this with the rice in it just fine we just usually prefer to make the rice fresh.).""
)"
202522,Southwestern Pinwheels,193162,Heather90,NA,PT30M,PT30M,2006-12-30T16:09:00Z,These were served at my baby shower when I had my son and my husband and I loved them. They are a hit at every party!,character(0),Lunch/Snacks,"c(""Brunch"", ""< 30 Mins"", ""For Large Groups"", ""Easy"")","c(""2"", ""2"", ""1"", ""5"", ""3/4"", ""3/4"", ""1"", ""1"", ""1"")","c(""green onions"", ""cream cheese"", ""flour tortillas"", ""black olives"", ""green chilies"", ""diced pimentos"")",NA,NA,53,4.3,2.3,11.7,98.6,2.4,0.3,0.3,1.4,50,NA,"c(""Let Cream Cheese sit out until soft."", ""Combine the first 3 ingredients."", ""Spread evenly over one side of the Tortillas."", ""Combine all the other ingredients and spread over the Cream Cheese mixture."", ""Roll up tight and cover with plastic wrap and chill at least two hours."", ""Take rolls out of plastic wrap and cut into 1-inch piece."", ""* I also like to use the Garlic and Herb Tortillas, but any kind can be used. I would sometime like to try the green ones (I think they are Spinach and Herb) for a nice touch."", 
""ENJOY!"")"
202523,Spinach – Creamy Parmesan,112818,Alan Leonetti,PT10M,PT20M,PT30M,2006-12-30T16:10:00Z,Make and share this Spinach – Creamy Parmesan recipe from Food.com.,character(0),Spinach,"c(""Greens"", ""Vegetable"", ""< 30 Mins"", ""Easy"")","c(""3"", ""2"", ""1/2"", ""2/3"", ""1"")","c(""frozen spinach"", ""cream cheese"", ""parmesan cheese"", ""coarse black pepper"")",3,2,297.9,21.4,12.9,61.5,554.7,13.2,7.5,2.6,19,4,NA,"c(""Place spinach in microwave to defrost.  Place the boxes on a dish to defrost the spinach, because the boxes will leak."", ""While spinach defrosts, place cream cheese and onions in a medium sauce pot over low heat."", ""When cream cheese melts, add Parmesan and black pepper to the cheese."", ""Drain spinach in a clean kitchen towel, wringing it out until dry."", ""Stir spinach into sauce, season with 1/8 teaspoon salt."", ""Allow spinach to sit over lowest heat possible 10 minutes, stirring occasionally.""
)"
202524,Green Onion Fritters,112818,Alan Leonetti,PT18M,PT10M,PT28M,2006-12-30T16:11:00Z,This is a wonderful recipe. You could also substitute other things instead of the green onions (scallions).,character(0),Onions,"c(""Vegetable"", ""Low Cholesterol"", ""Healthy"", ""Brunch"", ""< 30 Mins"", ""Easy"")","c(NA, ""1"", ""1/2"", ""7 -8"", NA)","c(""water"", ""green onions"")",NA,NA,130.6,1.6,0.3,6.8,399.7,25.1,1.6,0.6,3.8,4,NA,"c(""Fill a medium saucepan with 2-3 inches of vegetable oil and heat to medium-high heat."", ""Arrange a paper towel lined plate on the counter to place the fritters on when they come out of the hot oil."", ""In a bowl, make the batter by combining the all-in-one pancake mix with the water (the batter will be on the thick side)."", ""Add the chopped scallions and season with salt and pepper."", ""When the oil is ready for frying, drop spoonfuls of the scallion batter into the oil and fry on all sides until golden brown and puffy.  This should take no more than 3 to 4 minutes."", 
""Remove with a slotted spoon and drain on the paper towel lined plate.  Season with salt and pepper while they are still hot."")"
202526,Russian Omelet,305531,lazyme,PT5M,PT5M,PT10M,2006-12-30T16:11:00Z,This is a recipe I came up with trying to duplicate my favorite omelet from an old local Seattle restaurant called the Steak and Eggs. I usually use leftover potatoes from Recipe #177125 and often times make this in the microwave with my microwave omelet maker.,"c(""https://img.sndimg.com/food/image/upload/w_555,h_416,c_fit,fl_progressive,q_95/v1/img/recipes/20/25/26/jXe4F9aJS4SNim4qwUG5_Russian%20Omelet_2959.jpg"", ""https://img.sndimg.com/food/image/upload/w_555,h_416,c_fit,fl_progressive,q_95/v1/img/recipes/20/25/26/eIcxRjBDQ9GaH6abQ3ZW_awaldes%20002.JPG"", ""https://img.sndimg.com/food/image/upload/w_555,h_416,c_fit,fl_progressive,q_95/v1/img/recipes/20/25/26/Rrny9wsRAGW0v1LLJxAg_Russian%20Omelet.jpg"", ""https://img.sndimg.com/food/image/upload/w_555,h_416,c_fit,fl_progressive,q_95/v1/img/recipes/20/25/26/picpmAcb7.jpg"", 
""https://img.sndimg.com/food/image/upload/w_555,h_416,c_fit,fl_progressive,q_95/v1/img/recipes/20/25/26/pic3DS7bm.jpg"", ""https://img.sndimg.com/food/image/upload/w_555,h_416,c_fit,fl_progressive,q_95/v1/img/recipes/20/25/26/picukasgS.jpg"", ""https://img.sndimg.com/food/image/upload/w_555,h_416,c_fit,fl_progressive,q_95/v1/img/recipes/20/25/26/picBstg6a.jpg"", ""https://img.sndimg.com/food/image/upload/w_555,h_416,c_fit,fl_progressive,q_95/v1/img/recipes/20/25/26/picZoLqFN.jpg"", ""https://img.sndimg.com/food/image/upload/w_555,h_416,c_fit,fl_progressive,q_95/v1/img/recipes/20/25/26/picYsllLY.jpg"", 
""https://img.sndimg.com/food/image/upload/w_555,h_416,c_fit,fl_progressive,q_95/v1/img/recipes/20/25/26/picbJ7D66.jpg"", ""https://img.sndimg.com/food/image/upload/w_555,h_416,c_fit,fl_progressive,q_95/v1/img/recipes/20/25/26/picTfHr5b.jpg"")",Breakfast,"c(""Potato"", ""Vegetable"", ""< 15 Mins"")","c(""2"", ""2"", NA, ""1/2"", ""1/2"", ""2"")","c(""eggs"", ""water"", ""potato"", ""sour cream"", ""green onions"")",5,14,454.7,34.1,18.1,473.6,207.9,19.7,2,1.8,17.9,1,NA,"c(""Beat eggs with water; season with salt and pepper.  Set aside.  Spray an 8-inch omelet pan or nonstick skillet with cooking spray.   Heat skillet over medium heat."", ""Add potatoes to skillet. Heat until heated through. (Or microwave until heated through). Set aside."", ""Pour eggs into skillet.  (Eggs should set immediately at edges).  With an inverted pancake turner, carefully push cooked portions at edges toward center so uncooked portions can reach hot pan surface, tilting pan and moving cooked portions as necessary."", 
""Spoon potatoes over half of the omelet. Spoon sour cream over the potatoes.   Sprinkle green onions over the sour cream.  Cook for about 30 seconds more. Slide from pan onto plate."", ""Top omelet with a dollop of sour cream and green onions if desired."")"
202528,Chocolate Chocolate Chip Pancakes,387012,lricesk8rgirl,PT15M,PT5M,PT20M,2006-12-30T16:11:00Z,Make and share this Chocolate Chocolate Chip Pancakes recipe from Food.com.,character(0),Breakfast,"c(""Low Protein"", ""< 30 Mins"", ""Easy"")","c(""1"", ""3/4"", ""2"", ""1/3"")","""water""",4,1,133.3,6.5,3.7,2,119.6,20.8,2.5,10.2,2.4,3,8-9 Pancakes,"c(""Heat a large skillet or griddle pan to 375 or medium-high heat and lightly oil."", ""Combine pancake mix, cocoa powder, water, and semi-sweet chocolate chips."", ""Pour 1/4 cup batter for each pancake and cook for 1 to 2 minutes on each side, until bubbles form and pop."", ""Butter and drizzle chocolate syrup if wanted. Enjoy!"")"
202529,Corn and Bell Peppers Stuffed Zucchini,305531,lazyme,PT15M,PT8M,PT23M,2006-12-30T16:11:00Z,"This is a simple side dish that complements pork and grilled meats.  It's not one of my personal favorites as is, because we think it's a little bland, but I'm posting it because people have so many different tastes. I like to add additional herbs, jalapenos, and/or salsa to jazz it up a bit. ZWT Mid-West region (corn).","""https://img.sndimg.com/food/image/upload/w_555,h_416,c_fit,fl_progressive,q_95/v1/img/recipes/20/25/29/picVxEuVl.jpg""",Corn,"c(""Vegetable"", ""Low Protein"", ""Low Cholesterol"", ""Healthy"", ""< 30 Mins"", ""Easy"")","c(""4"", ""1"", ""3/4"", ""2"", ""1"", ""2"", ""2"", ""1/8"")","c(""zucchini"", ""water"", ""frozen whole kernel corn"", ""fresh corn kernels"", ""red bell peppers"", ""fresh basil"", ""dried basil"", ""green onions"", ""olive oil"", ""salt"")",4,1,34.8,1.4,0.2,0,43.4,5.6,1.2,1.2,1.3,8,NA,"c(""Cut zucchini lengthwise in half; place zucchini and water in microwavable dish."", ""Cover with plastic wrap, folding back one edge or corner 1/4 inch to vent steam."", ""Microwave on High 3 to 5 minutes or until zucchini is crisp-tender."", ""When cool enough to handle, scoop centers from zucchini, leaving 1/4-inch shells."", ""Mix remaining ingredients."", ""Spoon about 2 tablespoons corn mixture into each zucchini shell."")"
202531,Baked Potato Soup,326216,Mayniac May Family,PT5M,PT30M,PT35M,2006-12-30T16:12:00Z,I got this recipe out of a newspaper a couple of years ago and altered it a little to make it easier.,"c(""https://img.sndimg.com/food/image/upload/w_555,h_416,c_fit,fl_progressive,q_95/v1/img/recipes/20/25/31/picXVeaWC.jpg"", ""https://img.sndimg.com/food/image/upload/w_555,h_416,c_fit,fl_progressive,q_95/v1/img/recipes/20/25/31/picTwKjuJ.jpg"")",Potato,"c(""Vegetable"", ""< 60 Mins"")","c(""4"", ""2/3"", ""2/3"", ""7"", ""1/2"", ""1/2"", ""2"", ""1 1/2"", ""12"", ""8"")","c(""potatoes"", ""margarine"", ""all-purpose flour"", ""milk"", ""salt"", ""pepper"", ""green onions"", ""cheese"", ""sour cream"")",4,3,771.6,42.4,19.8,96.3,1142,71.2,6,3.5,28.3,NA,NA,"c(""Bake potatoes (easiest and fastest method - use the microwave - bake one at a time)."", ""Let potatoes cool, and scoop out pulp, discard skins."", ""In large pot, melt butter, stir in flour, continue to stir until smooth."", ""Stirring constantly, gradually add milk and cook over medium heat, stirring until thick and bubbly."", ""Add potatoes, salt, pepper, 1/2 the chopped onion, and 1/2 the bacon. (fast method, buy the already cooked bacon) add cheese."", ""Stir in sour cream."", ""This as listed is a very thick sauce."", 
""Add more milk if needed for desired consistency."", ""Also, salt and pepper to taste. This is very little salt and pepper for this recipe. I perfer little salt. Most people would add more."", ""Heat throughly."", ""When serving--top with green onion and bacon garnishes in each bowl."")"
202538,Easy Black Bean Soup,84583,Katha,PT10M,PT5M,PT15M,2006-12-30T16:13:00Z,Make and share this Easy Black Bean Soup recipe from Food.com.,"""https://img.sndimg.com/food/image/upload/w_555,h_416,c_fit,fl_progressive,q_95/v1/img/recipes/20/25/38/picIttc7j.jpg""",Black Beans,"c(""Beans"", ""Low Cholesterol"", ""Healthy"", ""< 15 Mins"", ""Inexpensive"")","c(""2"", ""1"", ""1"", ""1"", ""1/8"", ""4"", ""2"", NA)","c(""black beans"", ""chicken broth"", ""chunky salsa"", ""ground cumin"", ""garlic powder"", ""fat free sour cream"", ""green onions"", ""cheese"")",4.5,2,255.7,1.9,0.6,1.4,741.3,43.8,14.5,3.5,17.8,4,NA,"c(""In electric blender or food processor,combine beans,broth,salsa, cumin & garlic powder."", ""Blend until fairly smooth."", ""Heat mixture in a sauce pan over med heat until heated through."", ""Ladel into 4 bowls."", ""Top each bowl with 1/2 Tbs green onion & 1 Tbs sour cream, Add cheese if desired."")"
202539,Leftover Holiday Ham &amp; Split Pea Soup,27783,HeatherFeather,PT1H30M,PT15M,PT1H45M,2006-12-30T16:13:00Z,I make this every time I make a holiday ham to use up the leftovers. It smells so wonderful as it cooks and pleases even the so-called pea haters in my family.  Simple to prepare too..just chop all your veggies and ham up and toss everything into the pot and cook. No need to soak the peas overnight..just a rinse and drain before cooking.,"c(""https://img.sndimg.com/food/image/upload/w_555,h_416,c_fit,fl_progressive,q_95/v1/img/recipes/20/25/39/picpbLSRk.jpg"", ""https://img.sndimg.com/food/image/upload/w_555,h_416,c_fit,fl_progressive,q_95/v1/img/recipes/20/25/39/piciND57N.jpg"", ""https://img.sndimg.com/food/image/upload/w_555,h_416,c_fit,fl_progressive,q_95/v1/img/recipes/20/25/39/picxYVxMi.jpg"", ""https://img.sndimg.com/food/image/upload/w_555,h_416,c_fit,fl_progressive,q_95/v1/img/recipes/20/25/39/picrZOduB.jpg"")",Ham,"c(""Pork"", ""Vegetable"", ""Meat"", ""Christmas"", ""Savory"", ""< 4 Hours"")","c(""1"", ""8"", ""2"", ""2"", ""2"", ""2"", ""2"", ""4 -5"", ""1"", ""1"", ""1"", ""1/2"", ""1/2"", ""1/4 - 1/2"")","c(""water"", ""potatoes"", ""onions"", ""carrots"", ""celery"", ""cooked ham"", ""chicken bouillon powder"", ""chicken bouillon cubes"", ""dried marjoram"", ""poultry seasoning"", ""dried sage"", ""dried basil"", ""ground black pepper"", ""salt"")",5,18,280.5,5.5,1.9,25.5,239.6,38.9,13.5,5.9,19.9,NA,NA,"c(""Chop veggies and meat, then combine everything in a large stockpot -- going VERY EASY on the salt as your ham and bouillon might be salty enough already (you will test and add more later if needed)."", ""Stir, then bring to a boil over high heat."", ""Don't walk away from the pot.as soon as it comes to a boil,stir, then lower the heat to low and drop a lid on the pot, venting just a bit for a few minutes so you don't have a boilover."", ""As soon as the temperature drops enough to avoid a boilover (a few minutes), go ahead and let the lid sit fully on top of the pan."", 
""Let cook on low, covered, for about 1 1/2 hours,stirring once or twice, until all veggies are tender."", ""Give the finished soup a taste test and adjust salt and other seasonings as needed."")"
