RecipeId,Name,AuthorId,AuthorName,CookTime,PrepTime,TotalTime,DatePublished,Description,Images,RecipeCategory,Keywords,RecipeIngredientQuantities,RecipeIngredientParts,AggregatedRating,ReviewCount,Calories,FatContent,SaturatedFatContent,CholesterolContent,SodiumContent,CarbohydrateContent,FiberContent,SugarContent,ProteinContent,RecipeServings,RecipeYield,RecipeInstructions
77382,Quick Pasta Supper,67009,Hag chef,PT20M,PT15M,PT35M,2003-11-26T20:06:00Z,"This is my own recipe for a quick pasta meal. I love to use fusili, or rotini, but elbow or penne is good too. This is one of my favourite meals, real comfort food!","""https://img.sndimg.com/food/image/upload/w_555,h_416,c_fit,fl_progressive,q_95/v1/img/recipes/77/38/2/pic7XLufl.jpg""",One Dish Meal,"c(""Penne"", ""Meat"", ""European"", ""Low Cholesterol"", ""Healthy"", ""Kid Friendly"", ""Potluck"", ""< 60 Mins"", ""Beginner Cook"", ""Stove Top"", ""Easy"", ""Inexpensive"")","c(""1"", ""1 1/2"", ""1"", ""1"", ""1"", ""2"", NA, ""1"", ""1"", ""1"", ""1"", ""1"")","c(""olive oil"", ""ground beef"", ""onion"", ""garlic clove"", ""green peppers"", ""mushrooms"", ""diced tomatoes"", ""dried parsley"", ""dried basil"", ""pasta"")",4,1,512.5,17.6,5.7,57.8,691.3,61.8,4.3,13.7,26.2,8,NA,"c(""Bring a large pot of water to boil, for the pasta."", ""Scramble fry the ground beef in olive oil, with garlic, salt and pepper."", ""Add the onions, peppers and mushrooms, and saute until onion is soft."", ""Add the spaghetti sauce, diced tomatoes, parlsey and basil."", ""Simmer for 20 minutes, or up to 1 hour."", ""Meanwhile, cook the pasta according to package directions."", ""Drain."", ""Return to large pot."", ""Stir the sauce into the pasta, or serve separately."", ""Serve with freshly grated parmesan, mozzarella or cheddar cheese, homemade biscuits and a green salad."", 
""Variation: For a beef stroganoff type of dish, use 2 cans of mushroom soup and 1 can of milk instead of the tomatoes and spaghetti sauce, and 1 package of egg noodles, instead of pasta."", ""Kids love this!"")"
77609,Asian Turkey Salad,52282,chia2160,NA,PT10M,PT10M,2003-12-01T20:00:00Z,Make and share this Asian Turkey Salad recipe from Food.com.,character(0),Poultry,"c(""Meat"", ""Kosher"", ""Thanksgiving"", ""< 15 Mins"", ""No Cook"", ""Easy"")","c(""2"", ""3"", ""1"", ""1/2"", ""1/2"", ""1/4"", ""1"", ""1/4"", ""1/4"", ""1"", ""2"", ""2"", ""1"", ""1"", ""1/2"", ""1/2"", ""1"", ""1"")","c(""cabbage"", ""red bell pepper"", ""red onion"", ""basil"", ""cilantro"", ""scallion"", ""rice vinegar"", ""vegetable broth"", ""soy sauce"", ""fresh lime juice"", ""salt"", ""sugar"", ""garlic clove"", ""serrano chili"")",5,2,319.1,14.8,3,79.8,740.1,11.5,3.5,5.2,36,4,NA,"c(""To make dressing put ingredients in a blender, process until smooth."", ""Put all salad ingredients in a large bowl, toss with dressing serve."")"
202463,A Different Type of Chicken Wing,167527,cervantesbrandi,PT15M,PT20M,PT35M,2006-12-30T15:50:00Z,These wings have a great flavor please do not let the ingredients scare you away from trying these great wings!,character(0),Chicken,"c(""Poultry"", ""Meat"", ""Asian"", ""< 60 Mins"", ""Beginner Cook"", ""Easy"", ""Inexpensive"")","c(""1"", ""1/2"", ""1/2"", ""12"", ""1"", ""1"", NA)","c(""white vinegar"", ""pepper"", ""garlic"", ""chicken wings"", ""flour"", ""seasoning salt"")",NA,NA,453.8,23.8,6.6,113.2,111.1,24.7,0.9,0.3,30.2,4,NA,"c(""Mix the vinegar, pepper, and garlic in a bowl and chicken wings."", ""Let the chicken wings sit for about 20 minutes but no longer than that as the vinegar doesn't take long to soak inches"", ""Mix the flour and season salt in a separate bowl."", ""After marinading the wings dip each in flour and place the wings in oil that has been heated to medium high."", ""Fry wings until they are a deep golden brown color."", ""I always serve these wings as an Asian appetizer along with hot mustard and teriyaki dipping sauces!"", 
""Enjoy!"")"
202464,Barefoot Contessa's Parmesan Roasted Asparagus,67103,Juenessa,PT20M,PT10M,PT30M,2006-12-30T15:51:00Z,"Adapted from Barefoot Contessa Family Style Cookbook, 2002.  Roasted asparagus is so yummy and is good with or without the cheese, so you decide!","c(""https://img.sndimg.com/food/image/upload/w_555,h_416,c_fit,fl_progressive,q_95/v1/img/recipes/20/24/64/picG2sltD.jpg"", ""https://img.sndimg.com/food/image/upload/w_555,h_416,c_fit,fl_progressive,q_95/v1/img/recipes/20/24/64/picJtnIP8.jpg"")",Vegetable,"""< 30 Mins""","c(""2 1/2"", ""2"", ""1/2"", ""1/4"", ""1/2"", ""2"")","c(""fresh asparagus"", ""olive oil"", ""kosher salt"", ""sea salt"", ""lemon pepper"", ""asiago cheese"", ""romano cheese"", ""lemons"")",5,8,113.6,7.1,2.1,7.3,325.1,7.7,4,3.6,7.4,6,NA,"c(""Preheat oven to 400 degrees."", ""If the stalks of the asparagus are thick, peel the bottom half of each or break the bottom part off."", ""Combine all the ingredients, except the cheese, in a bowl."", ""After combining, arrange the asparagus on a parchment-lined baking sheet in a single layer."", ""Roast for 15 to 20 minutes, until tender."", ""Sprinkle with the cheese and return to the oven for another minute."", ""Serve with lemon wedges."", ""**Ina Garten prefers thick asparagus to  thin ones; as they have more flavor.""
)"
202465,Leek and Potato Tart,322548,PinkCherryBlossom,PT1H20M,PT20M,PT1H40M,2006-12-30T15:52:00Z,the crust in this can be varying the nuts you use or replacing them with 3 tbsp of fresh chopped herbs.,character(0),Savory Pies,"c(""Potato"", ""Cheese"", ""Vegetable"", ""< 4 Hours"")","c(""225"", ""1"", ""150"", ""50"", ""1"", ""450"", ""40"", ""450"", ""300"", ""3"", ""175"", ""1"", NA)","c(""plain flour"", ""salt"", ""butter"", ""walnuts"", ""leeks"", ""butter"", ""new potatoes"", ""sour cream"", ""eggs"", ""gruyere cheese"", ""nutmeg"", ""chives"")",NA,NA,806.2,52.9,28.8,246.3,380.2,62.8,4.8,4.2,22.3,6,NA,"c(""Heat oven to 200C/400F."", ""Sift flour and salt into a bowl. Rub butter in with fingers until the mix resembles breadcrumbs. Add nuts."", ""Mix egg yolk with a 3 tbsp water and add to bowl. Mix with hands to form a dough."", ""Knead dough for a few mins to bring it together then wrap in cling film and chill for 20 minutes."", ""Roll out pastry and use it to line a very deep flan tin or an 8 inch springform tin. Chill for another 30 minutes."", ""Melt the butter over a high heat and cook the leeks for 2 - 3 minutes Lower the heat and cook for a further 25 mins until very soft. Remove from heat."", 
""Cook the potatoes in boiling water until almost tender. Drain and slice."", ""Add the leeks to the potatoes followed by the soured cream, eggs, cheese, nutmeg and seasoning if desired. Stir well and pour into pastry case."", ""Bake for 20 mins on the middle shelf. After 20 mins reduce heat to 190C/375F and cook for a further 30 minutes The filling should be set."")"
202573,Lentil Rice Dish  (Mujadarah Arabic Dish),403144,Hommus,PT25M,PT10M,PT35M,2006-12-30T19:53:00Z,"This Lentils Rice recipe is known as Mujadarah in the Arab countries. There is many different recipes for Mujadarah, this  recipe is very easy to cook with little Ingredients, and besides being nutritious,it is inexpensive. This recipe is an excellent vegetarian dish. Mujadarah is can be served with finely chopped Tomatoes salad if desired. Se my recipe for Tomato Salad.","""https://img.sndimg.com/food/image/upload/w_555,h_416,c_fit,fl_progressive,q_95/v1/img/recipes/20/25/73/picfdzjX6.jpg""",Long Grain Rice,"c(""Rice"", ""Lentil"", ""Beans"", ""Palestinian"", ""Southwest Asia (middle East)"", ""Asian"", ""Low Protein"", ""Vegan"", ""Low Cholesterol"", ""< 60 Mins"", ""Steam"", ""Beginner Cook"", ""Easy"", ""Inexpensive"")","c(""1"", ""1/3"", ""4"", NA, ""1/2"", ""1"", ""1/4"", ""2"")","c(""lentils"", ""basmati rice"", ""chicken broth"", ""vegetable broth"", ""salt"", ""black pepper"", ""cumin"", ""olive oil"", ""onions"")",5,9,266.4,14.3,2,0,13.4,29.3,5.8,4.2,6.6,NA,NA,"c(""Saute Onions with olive oil(stirring occasionally) until golden brown. Reserve 4 tablespoons of browned onions for garnish."", ""Place lentils,water,salt,and black pepper in different saucepan and cook over medium heat for about 20 minutes or until lentils are tender."", ""Add to lentils the uncooked rice,browned onions and cumin and mix. Cover and simmer for another 15 minutes or until water is absorbed and rice is tender."", ""Place Lentils Rice dish(mujadarah)in serving dish and garnish with 4 tablespoons of browned onions."", 
""Mujadarah is best when served with Tomato salad.  See my recipe for Tomato salad."")"
202468,Sweet Potato Cakes,322548,PinkCherryBlossom,PT50M,PT20M,PT1H10M,2006-12-30T15:55:00Z,Make and share this Sweet Potato Cakes recipe from Food.com.,character(0),Lunch/Snacks,"c(""Yam/Sweet Potato"", ""Potato"", ""Vegetable"", ""Kid Friendly"", ""< 4 Hours"", ""Easy"")","c(""700"", ""25"", ""1"", ""1"", ""1"", ""1"", ""50"", ""2"")","c(""sweet potatoes"", ""butter"", ""onion"", ""garlic clove"", ""nutmeg"", ""egg"")",5,1,284.1,13.1,4.5,59.9,148.4,38.3,5.7,8.6,4.5,4,NA,"c(""Cook the sweet potatoes in boiling salted water until tender. Drain and mash until smooth."", ""melt the butter in a sauce pan and cook the onion and garlic gently for 10 mins until soft."", ""Add the onions to the sweet potato along with the nutmeg and seasoning if desired. Mix well and leave to cool."", ""Place the egg in a shallow bowl and the polenta in another ."", ""When the potato is cook enough to handle divide into four and form into cake shapes."", ""Dip the cakes in the egg and then the polenta, once done refrigerate for 30 minutes."", 
""Heat the oil and cook the potato cakes for 4 - 5 mins each side."")"
202470,Garlicky Mushroom Pakoras,322548,PinkCherryBlossom,PT15M,PT20M,PT35M,2006-12-30T15:55:00Z,Make and share this Garlicky Mushroom Pakoras recipe from Food.com.,"""https://img.sndimg.com/food/image/upload/w_555,h_416,c_fit,fl_progressive,q_95/v1/img/recipes/20/24/70/picSAHjBd.jpg""",Lunch/Snacks,"c(""Vegetable"", ""Asian"", ""Indian"", ""Low Cholesterol"", ""Healthy"", ""Spicy"", ""< 60 Mins"")","c(""175"", ""1/2"", ""1/4"", ""1"", ""1"", ""200"", ""2"", ""1"", ""500"", NA)","c(""gram flour"", ""salt"", ""baking powder"", ""cumin seed"", ""chili powder"", ""water"", ""garlic cloves"", ""onion"", ""button mushrooms"")",4,2,134.5,2.3,0.2,0,240.1,20.6,4.2,4.9,8.7,6,NA,"c(""Place the gram flour, salt, baking powder, cumin and chilli in a bowl. Make a well in the centre and add the water, mixing well to for a smooth batter."", ""Add the garlic and onion to the batter and mix inches Leave the mixture to stand for ten mins while you wipe and trim your mushrooms."", ""mix the mushrooms into the batter and stir to coat."", ""Heat enough oil to cover the pakoras in a pan to about 180C (so a cube of bread browns in 30 seconds)."", ""Once the oil is hot fry a few pakoras at a time until golden brown. Drain and keep warm."", 
""Serve with salt and lemon juice."")"
202471,Chicken Casadillas,418508,thomasmoore24,PT10M,PT10M,PT20M,2006-12-30T15:55:00Z,Make and share this Chicken Casadillas recipe from Food.com.,character(0),Lunch/Snacks,"c(""Chicken Breast"", ""Chicken"", ""Poultry"", ""Cheese"", ""Meat"", ""Mexican"", ""< 30 Mins"", ""Beginner Cook"", ""Easy"")","c(""18"", ""6"", ""2"", ""1"")","c(""chicken"", ""tortillas"", ""mozzarella cheese"", ""canola oil"")",NA,NA,462.3,23.9,8.6,68.3,715.5,36.8,2.2,1.7,23.7,6,6 quesadillas,"c(""Cook chicken to your preference and tear into small pieces."", ""Place about 3 oz of chicken in with  about 1/3 cup of grated cheese onto one side of a tortilla."", ""Add canola oil to frying pan on medium heat."", ""Add one quesadilla and monitor to see if bottom is browned in some places, than flip over and repeat with all tortillas."")"
202472,Cyprus - Souvlakia - Pork Kebab,35918,GRECORICAN,PT45M,PT30M,PT1H15M,2006-12-30T15:56:00Z,"I will be posting some recipes from my home country, Cyprus, that I have collected from the web and want to safe keep.  I have not tried all of them, but intend to one day, and I hope you will too.",character(0),Pork,"c(""Meat"", ""European"", ""Very Low Carbs"", ""< 4 Hours"")","c(""1"", NA, ""4"", ""1"", ""5"", NA, NA)","c(""salt"", ""tomatoes"", ""onion"", ""fresh parsley"", ""lemon juice"")",NA,NA,647.4,47.5,16.4,182.5,127.4,7.7,2.1,4.4,45.1,NA,NA,"c(""Thread the meat cubes on to the skewers."", ""Make sure the barbecue has reached the right heat. Ideally for the best results kebab should be cooked over charcoal.  Place the skewers on the barbeque and liberally apply salt, turn the skewers over and salt the other side.  Turn the skewers from time to time to ensure that the meat cooks evenly on all sides."", ""Just before the souvlakia are cooked, warm some Pitta bread over the grill.  Remove the souvlakia from the grill and using a fork take the meat off the skewers and put it into a serving dish."", 
""Divide a pitta in two and in the pocket spoon in the meat, tomatoes, onion, parsley, salt and lemon juice."")"
202473,"Vegan Green Garden Puree (For Pizza, Lasagna or Pasta)",237123,VegSocialWorker,PT15M,PT15M,PT30M,2006-12-30T15:56:00Z,"From Vegan with a Vengeance by Isa Chandra Moskowitz.  I just received this gem of a cookbook for Christmas.  We made this puree as a stuffing for lasagna last night and it was really good.  Used whole wheat pasta, the puree, tomato sauce, spinach and mushrooms.  Yum, yum, yum.  Thought I'd share this recipe with you all.  It takes the place of ricotta cheese in any type of pizza or pasta recipe.  And it rocks!  We left out the parsley because I forgot to buy it, and it was still a nice green color.  Enjoy.",character(0),Vegetable,"c(""Lactose Free"", ""Vegan"", ""Low Cholesterol"", ""Egg Free"", ""Healthy"", ""Free Of..."", ""< 30 Mins"", ""Small Appliance"")","c(""1"", ""1"", ""1"", ""1"", ""2"", ""1"", ""4"", ""2"", ""1/2"", ""1/8"", ""1"", ""1"")","c(""asparagus"", ""green beans"", ""garlic cloves"", ""flat leaf parsley"", ""scallions"", ""extra virgin olive oil"", ""nutmeg"", ""extra firm tofu"", ""basil leaves"")",NA,NA,268.9,17.3,2.1,0,59.4,19.3,9.1,5.1,15.4,NA,6 cups,"c(""Have ready a large bowl of ice water."", ""Bring a large pot of salted water to a boil."", ""Add the asparagus and green beans; boil for 2 minutes.  Add the frozen peas and boil for 2 more minutes."", ""Drain vegetables and submerge in the ice water to stop the cooking."", ""Pulse the almonds to a fine powder.  I used the blender for this."", ""Add the vegetables, garlic, parsley, scallions, olive oil, lemon juice, and nutmeg; puree until smooth."", ""Note: My blender could not accommodate all of the ingredients so I needed to puree in batches.  I also had to add some water otherwise it would not blend.  All together I added about 1/2 cup of water and it was not too runny in the end."", 
""In a large bowl, mash the tofu with your hands until it has a ricotta-like consistency.  I used a hand held immersion blender for this and it worked beautifully."", ""Add the puree and mix well."", ""Fold in the basil."", ""Cover and refrigerate until ready to use."")"
202474,Paglia E Fieno,322548,PinkCherryBlossom,PT10M,PT10M,PT20M,2006-12-30T15:57:00Z,The English translation for this is &quot;straw and hay&quot; It refers to the colours of the pasta when mixed together don't worry about finding green and white pasta if you can't just use white.,character(0),One Dish Meal,"c(""Vegetable"", ""European"", ""< 30 Mins"")","c(""60"", ""450"", ""200"", ""450"", ""1"", ""60"", ""1"")","c(""butter"", ""fresh peas"", ""tagliatelle pasta noodles"", ""olive oil"", ""parmesan cheese"", ""nutmeg"")",NA,NA,900.6,44.1,23.9,209.6,363.9,98.5,9.5,8.7,29,4,NA,"c(""Melt the butter in a saucepan and add the peas. Cook on a low heat for 2 - 3 minutes."", ""Add 150ml of the cream to the pan, bring to the boil and simmer for 1 - 1 1/2 minutes Remove from heat."", ""Bring a pan of water to the boil and add the olive oil. Cook the pasta until al dente. drain and return to the pan."", ""Add the sauce to the pasta and return to the heat. Stir in the remaining cream and ensure the peas are hot."", ""Stir through the parmesan, season if desired and serve."")"
202475,Gnocchi Romana,322548,PinkCherryBlossom,PT45M,PT1H15M,PT2H,2006-12-30T15:57:00Z,"This is a traditional Italian recipe but is very rich, serve it as a side. For a less rich version omit the eggs.",character(0),European,"c(""High In..."", ""< 4 Hours"")","c(""700"", ""1"", ""90"", ""225"", ""125"", ""2"", ""60"")","c(""milk"", ""nutmeg"", ""butter"", ""semolina"", ""parmesan cheese"", ""eggs"", ""gruyere cheese"")",5,1,705.7,41.3,24.5,221.8,776.3,50.5,2.2,0.6,32.6,4,NA,"c(""Pour the milk into a pan and bring to the boil. remove from the heat and add the nutmeg, 25g of the butter and seasoning if desired."", ""Gradually stir the semolina into the milk whisking out any lumps. Return to a low heat and simmer for 10 minutes."", ""Beat half the parmesan into the semolina followed by the eggs until smooth."", ""Spread the semolina on a sheet of baking parchment or oiled tray. Smooth the surface so it is 1/2 inch thick. Allow to cool then  chill in the refrigerator for 1 hour."", 
""Once chilled use a cookie cutter to cut circles out of the semolina dough."", ""Grease a shallow ovenproof dish and lay any trimmings from the semolina in the bottom. Lay the circles in an overlapping fashion until used up."", ""Melt the remaining butter and pour over the gnocchi. Sprinkle with the cheeses."", ""Bake for 30 mins at 200C/400F."")"
202476,Puff Pastry Toasted Sandwiches in Your Sandwich Maker!,102058,kiwidutch,PT10M,PT10M,PT20M,2006-12-30T15:57:00Z,"My Zaar friend Kooka suggested making a toasted sandwich without the toast ! I got curious, played around with her idea and et Voila! she told me to post the recipe.
Ok, healthy.. not really... yummy... sure is!
Puff pastry here in the Netherlands is a pest to use in regular large pies becuase it comes in a box of 10 small individual squares. think jig-saw pieces then you want to make a large pie, and it usually takes me less time to make and roll my own... but my small ready made squares are PERFECT for this recipe.. if you are lucky enough to be able to buy ready made puff pastry in one big piece you will need to cut it up to fit.
COMFORT FOOD... the fillings are as endless as peoples' personal taste.. but things that cook quick, yes? I used three Knackworstjes but the Zaar database doesn't recognise those so Smokies (mini knackworstjes) are the closest description I can get.
In Honour of Kooka's idea I dedicate this to ZWT REGION: Australia.","c(""https://img.sndimg.com/food/image/upload/w_555,h_416,c_fit,fl_progressive,q_95/v1/img/recipes/20/24/76/pictarK7k.jpg"", ""https://img.sndimg.com/food/image/upload/w_555,h_416,c_fit,fl_progressive,q_95/v1/img/recipes/20/24/76/picPQjFSH.jpg"")",Lunch/Snacks,"c(""Cheese"", ""Australian"", ""Kid Friendly"", ""< 30 Mins"", ""Beginner Cook"", ""Easy"")","c(""1"", ""50"", ""25"", ""5"", NA, NA, ""1"", NA, NA, NA, NA, NA)","c(""puff pastry"", ""cheese"", ""butter"", ""spring onion"", ""chives"", ""egg"", ""tomatoes"", ""ham"", ""mashed potatoes"", ""onion"")",5,5,1202.4,94,34.9,215.1,1692.9,59.7,1.8,2.6,30.3,NA,2 sandwiches,"c(""Melt the butter and spread on the toasted sandwich maker inside top and bottom cooking plates."", ""Cut thawed pastry to the same size that the bread would usually be and place one piece on the bottom of the sandwich maker top with grated cheese and extra fillings of your choice. Top with another piece of pastry."", ""Repeat with the other side of the toasted sandwich maker to fill up the other side."", ""Close the sandwich maker to seal the pastry together and enclose the filling."", ""Cook until pastry is golden brown and cooked (about 10 minutes)."", 
""Trim off any uncooked pastry (I had a little bit but it was only a thin sliver)."")"
202477,Barefoot Contessa's Tequila Lime Chicken,67103,Juenessa,PT20M,PT20M,PT40M,2006-12-30T15:57:00Z,"Adapted from Barefoot Contessa Family Style cookbook, 2002.  Ina's recipe calls for 1/2 cup of tequila and our family thinks the tequila flavor is a little too strong, so have decreased the tequila to 1/4 cup.",character(0),Chicken Breast,"c(""Chicken"", ""Poultry"", ""Meat"", ""< 60 Mins"")","c(""1/4"", ""1"", ""1/2"", ""1"", ""1"", ""1  - 1 1/2"", ""3"", ""2"", ""1"", ""6"")","c(""lime juice"", ""chili powder"", ""cilantro"", ""garlic cloves"", ""kosher salt"", ""fresh ground black pepper"", ""boneless chicken breasts"")",5,2,276.3,13.7,3.9,92.8,686.9,7.1,0.8,2.6,30.9,6,NA,"c(""Combine the tequila, lime juice, orange juice, chili powder, minced cilantro, jalapeno pepper, garlic, salt, and pepper in a large bowl."", ""Add the chicken breasts."", ""Refrigerate overnight (or at LEAST 8 hours!)."", ""The next day, heat your grill and brush the rack with oil to prevent the chicken from sticking."", ""Remove chicken breasts from the marinade, sprinkle well with salt and pepper, and grill them skin-side down for about 5 minutes, until nicely browned."", ""Turn the chicken and cook for another 10 minutes, until just cooked through."", 
""Remove from grill to a plate."", ""Cover tightly and let rest for 5 minutes."", ""Serve hot or at room temperature."", ""*Ina uses Cuervo Gold tequila."", ""** She also says there is NO substitute for freshly squeezed lime juice."", ""***Cook time does not include marinating the chicken overnight."")"
202478,Spicy Pulled Pork,107823,Zanna_409104061,PT6H,PT15M,PT6H15M,2006-12-30T15:58:00Z,Make and share this Spicy Pulled Pork recipe from Food.com.,character(0),Stew,"c(""Pork"", ""Meat"")","c(""1"", ""1"", ""2 3/4"", ""1"", ""1"", ""1"", ""1"", ""2"", NA)","c(""crushed tomatoes"", ""tomatoes in puree"", ""boneless pork shoulder"", ""dried oregano"", ""adobo sauce"", ""chipotle chile in adobo"", ""onion"", ""bay leaves"")",NA,NA,426.5,31.7,10.9,110.8,319.2,7.7,1.6,4.2,27,8,NA,"c(""In a 5 quart slow cooker, combine all ingredients except pork."", ""Add pork, toss to coat."", ""Cover, cook on high setting until meat is pull-apart tender, about 6 hours."", ""Transfer meat to a large bowl, shred pork with forks."", ""Return meat to pot, stir well."", ""Serve with tortillas and shredded cheese, or whatever kind of bread you like."")"
202479,Kung Pao Shrimp,114882,marisk,NA,PT30M,PT30M,2006-12-30T15:58:00Z,I haven't tried this recipe yet but I've tasted PF Chang's Kung Pao Shrimp at their restaurant served over a crispy white noodle.  It was to die for.  I'm hoping this recipe will be as good as the original.,character(0),< 30 Mins,NA,"c(""2"", ""12"", ""2"", ""32"", ""4"", ""20"", NA)","c(""garlic"", ""shrimp"", ""green onions"", ""chilies"")",NA,NA,345.4,4.6,0.8,361.8,368.6,24.2,3.5,11.6,53,4,NA,"c(""Heat wok (smoking), introduce oil and shrimp, separate and velvet for 1 to 2 minutes. Do not overcook."", ""Carefully pour shrimp and oil onto oil skimmer."", ""Stir fry chile pods and onions."", ""Add garlic and Kung Pao sauce."", ""Add shrimp, toss."", ""Add peanuts and chile flakes."")"
202480,Bacon Spinach and Cream Potatoes,105298,kdsale,PT15M,PT15M,PT30M,2006-12-30T15:58:00Z,Make and share this Bacon Spinach and Cream Potatoes recipe from Food.com.,character(0),Pork,"c(""Potato"", ""Vegetable"", ""Meat"", ""Low Protein"", ""< 30 Mins"", ""Beginner Cook"", ""Easy"")","c(""3"", ""1"", ""4"", ""1"", ""2"", NA, NA, ""1/4"")","c(""idaho potatoes"", ""onion"", ""bacon"", ""frozen spinach"", ""extra virgin olive oil"", ""nutmeg"")",5,1,393.8,20,10.3,54.5,215.2,46.4,7.8,3.3,10.7,NA,NA,"c(""Dice potatoes, place in pot and cover with water."", ""Bring to a boil, add salt to water."", ""Cook until tender (10-15 min.)."", ""In a small skillet over medium heat, add bacon and brown (7-8 minutes)."", ""Add onions, cook until soft (5 more minutes)."", ""Drain potatoes and return to pot."", ""Add bacon and onions, and defrosted/drained spinach; mash to combine."", ""Add cream and EVOO; mash until smooth."", ""Add salt, pepper, and nutmeg."", ""Enjoy."")"
202481,Wonder Salad,114882,marisk,NA,PT45M,PT45M,2006-12-30T15:58:00Z,Make and share this Wonder Salad recipe from Food.com.,character(0),Low Protein,"""< 60 Mins""","c(""16"", ""16"", ""12"", ""12"", ""4"", ""6"", ""12"", ""8"", ""8"", ""12"", ""24"", ""16"", ""80"")","c(""feta cheese"", ""provolone cheese"", ""mortadella"", ""black olives"", ""green olives"", ""red onions"", ""cucumbers"", ""roma tomatoes"", ""romaine lettuce"")",NA,NA,6386.2,587.9,118.7,192.4,25674.9,251.1,20.3,179.7,67.9,4,NA,"c(""Place the greens, tomatoes, onions, and cucumbers in a mixing bowl. Add the dressing and toss well.  Mound onto a plate."", ""Lay mortadella across one side of the salad and the pepperoni across the other."", ""Spread diced provolone over the top."", ""Place roasted peppers over the provolone cheese."", ""Place crumbled feta over the peppers."", ""Place pepperoncini over the top."", ""Place the black olives on each end of the plate and the green olives on the sides and serve."")"
